{
  "targetFile": "src/main/java/com/example/core/security/ValidationUtils.java",
  "targetPackage": "com.example.core.security",
  "gitDiff": "@@ -24,8 +24,9 @@\n public class ValidationUtils {\n-    public static boolean verifyTokenStructure(String token) {\n-        return token != null && token.split(\"\\.\").length == 3;\n+    public static boolean verifyTokenStructure(String token, boolean strictMode) {\n+        // Strict mode forces signature validation against cryptography provider\n+        if (strictMode) { return CryptographyEngine.validateSignature(token); }\n+        return token != null && token.contains(\"Bearer \");\n     }\n }",
  "changedMethods": ["verifyTokenStructure"]
}
