{
  "targetFile": "components/flow-orchestration-framework/org.wso2.carbon.identity.flow.inflow.extensions/src/main/java/org/wso2/carbon/identity/flow/inflow/extensions/executor/InFlowExtensionExecutor.java",
  "targetPackage": "org.wso2.carbon.identity.flow.inflow.extensions.executor",
  "gitDiff": "diff --git a/components/flow-orchestration-framework/org.wso2.carbon.identity.flow.inflow.extensions/src/main/java/org/wso2/carbon/identity/flow/inflow/extensions/executor/InFlowExtensionExecutor.java b/components/flow-orchestration-framework/org.wso2.carbon.identity.flow.inflow.extensions/src/main/java/org/wso2/carbon/identity/flow/inflow/extensions/executor/InFlowExtensionExecutor.java\nindex 315dd7f76a67..9c5925cc662b 100644\n--- a/components/flow-orchestration-framework/org.wso2.carbon.identity.flow.inflow.extensions/src/main/java/org/wso2/carbon/identity/flow/inflow/extensions/executor/InFlowExtensionExecutor.java\n+++ b/components/flow-orchestration-framework/org.wso2.carbon.identity.flow.inflow.extensions/src/main/java/org/wso2/carbon/identity/flow/inflow/extensions/executor/InFlowExtensionExecutor.java\n@@ -52,28 +52,17 @@ import java.util.Map;\n import java.util.UUID;\n \n /**\n- * This class is responsible for executing In-Flow Extension actions during flow execution.\n- * It integrates with the {@link ActionExecutorService} to call external services and process\n- * their responses.\n- *\n- * <p>Execution lifecycle:</p>\n- * <ol>\n- *   <li>Extract executor metadata: {@code actionId}.</li>\n- *   <li>Build a minimal {@link FlowContext} containing only the {@link FlowExecutionContext}.\n- *       The request builder resolves access config / encryption from the action and populates\n- *       additional FlowContext keys for the response processor.</li>\n- *   <li>Invoke the external service via {@link ActionExecutorService}.</li>\n- *   <li>Map the {@link ActionExecutionStatus} to an {@link ExecutorResponse}.\n- *       On {@code SUCCESS}, pending context updates collected by the response processor\n- *       are extracted from the {@link FlowContext} and forwarded to\n- *       {@code TaskExecutionNode} via {@link ExecutorResponse} fields\n- *       ({@code updatedUserClaims}, {@code userCredentials}, {@code contextProperties}).</li>\n- * </ol>\n+ * Executes In-Flow Extension actions during flow execution by delegating to\n+ * {@link ActionExecutorService} and mapping the result to an {@link ExecutorResponse}.\n+ * On success, pending context updates (claims, credentials, properties) are forwarded\n+ * to the flow engine through the response object.\n  */\n public class InFlowExtensionExecutor implements Executor {\n \n     private static final Log LOG = LogFactory.getLog(InFlowExtensionExecutor.class);\n     private static final String EXECUTOR_NAME = \"InFlowExtensionExecutor\";\n+    private static final String CONFIG_PARAM_ACTION_TYPE = \"actionType\";\n+    private static final String CONFIG_PARAM_ACTION_ID = \"actionId\";\n \n@@ -84,29 +73,16 @@ public class InFlowExtensionExecutor implements Executor {\n     }\n \n     @Override\n-    @SuppressWarnings(\"unchecked\")\n     public ExecutorResponse execute(FlowExecutionContext context) throws FlowEngineException {\n \n-        ExecutorResponse response = new ExecutorResponse();\n-\n         String actionId = getMetadataValue(context, InFlowExtensionConstants.ACTION_ID_METADATA_KEY);\n         if (actionId == null || actionId.isEmpty()) {\n             LOG.warn(\"No action ID configured for In-Flow Extension executor. Cannot execute.\");\n-            if (LoggerUtils.isDiagnosticLogsEnabled()) {\n-                LoggerUtils.triggerDiagnosticLogEvent(new DiagnosticLog.DiagnosticLogBuilder(\n-                        InFlowExtensionLogConstants.COMPONENT_ID,\n-                        InFlowExtensionLogConstants.ActionIDs.EXECUTE)\n-                        .resultMessage(\"In-Flow Extension action execution failed: action ID is not configured.\")\n-                        .configParam(\"actionType\", ActionType.IN_FLOW_EXTENSION.getDisplayName())\n-                        .logDetailLevel(DiagnosticLog.LogDetailLevel.APPLICATION)\n-                        .resultStatus(DiagnosticLog.ResultStatus.FAILED));\n-            }\n-            response.setResult(ExecutorStatus.STATUS_ERROR);\n-            response.setErrorCode(Constants.ErrorMessages.ERROR_CODE_INFLOW_EXTENSION_ERROR.getCode());\n-            response.setErrorMessage(\"Extension is not configured.\");\n-            response.setErrorDescription(\"The In-Flow Extension action is missing required configuration. \" +\n+            triggerDiagnosticFailure(null,\n+                \"In-Flow Extension action execution failed: action ID is not configured.\");\n+            return buildErrorResponse(\"Extension is not configured.\",\n+                \"The In-Flow Extension action is missing required configuration. \" +\n                     \"Contact your administrator.\");\n-            return response;\n         }",
  "changedMethods": ["execute", "buildErrorResponse", "triggerDiagnosticFailure"]
}